{
  "schema_version": "agent-node/v0alpha1",
  "role": "researcher-agent",
  "tool_policy": {
    "allowed_tools": ["READ_FILE", "ARCHIVE_DATA", "SCAN_VAULT"],
    "denied_tools": []
  },
  "broadcast_policy": {
    "allow_agent_broadcasts": true,
    "max_payload_bytes": 32768
  },
  "task_policy": {
    "allow_announce": true,
    "allow_claim": true,
    "allow_complete": true,
    "allow_verify": false,
    "allowed_requested_roles": ["researcher-agent"]
  },
  "vault_policy": {
    "vault_dir": "vault_researcher-agent",
    "allow_read": true,
    "allow_list": true,
    "allow_write": true
  },
  "provider_policy": {
    "allowed_providers": [],
    "allowed_models": [],
    "allow_local": true,
    "allow_cloud": false
  }
}
